id,title,presenters,primary_authors,co_authors,collaboration,mini_abstract,poster_link,video_link,all_links,abstract,track,category,abstract_url,poster_session
306,Measurement of the atmospheric muon flux between 2.2 and 3.4 km depth undersea with KM3NeT,Massimiliano Lincetto,"Karel Melis,Massimiliano Lincetto,Simone Biagi","Dorothea Samtleben,Jannik Hofestädt,Rosa Coniglione,Vladimir Kulikovskiy",KM3NeT,The first KM3NeT detection units measure the atmospheric muon flux as a function of water depth.,https://indico.fnal.gov/event/19348/contributions/186226/attachments/129586/157250/KM3NeT_CONF_2020_002_Poster_Neutrino2020_DU_Lincetto_DepthDependence.pdf,https://indico.fnal.gov/event/19348/contributions/186226/attachments/129586/157773/Lincetto_DepthDependence.mp4,"https://indico.fnal.gov/event/19348/contributions/186226/attachments/129586/157250/KM3NeT_CONF_2020_002_Poster_Neutrino2020_DU_Lincetto_DepthDependence.pdf,https://indico.fnal.gov/event/19348/contributions/186226/attachments/129586/157773/Lincetto_DepthDependence.mp4",null,null,null,https://indico.fnal.gov/event/19348/contributions/186226/contribution.pdf,1
307,Using boosted decision trees to identify supernova neutrino interactions in DUNE,Erin Conley,Erin Conley,,Deep Underground Neutrino Experiment,Analysis of a supernova burst can be improved by separating different interaction channels,https://indico.fnal.gov/event/19348/contributions/186196/attachments/129399/156955/Neutrino2020Poster.pdf,NotFound,https://indico.fnal.gov/event/19348/contributions/186196/attachments/129399/156955/Neutrino2020Poster.pdf,null,null,null,https://indico.fnal.gov/event/19348/contributions/186196/contribution.pdf,2
308,The CROSS experiment: rejecting surface events with PSD,Hawraa Khalife,Hawraa Khalife,,The CROSS experiment,Thin-film-coated bolometers for 0νββ search show PSD capability between surface and bulk events.,NotFound,NotFound,https://indico.fnal.gov/event/19348/contributions/186492/attachments/129345/156878/nu2020_Khalife.pptx,null,null,null,https://indico.fnal.gov/event/19348/contributions/186492/contribution.pdf,3
309,Exploring the effect of Lorentz invariance violation with the currently running long-baseline experiments.,RUDRA MAJHI,RUDRA MAJHI,"Rukmani Mohanta,Soumya C.",NOvA,Sensitivity Limits on LIV parameters and their effects are studied for NOvA and T2K experiments.,https://indico.fnal.gov/event/19348/contributions/186573/attachments/129731/157511/LIV-NEUTRINO-2020-ID-309.mp4,https://indico.fnal.gov/event/19348/contributions/186573/attachments/129731/157511/LIV-NEUTRINO-2020-ID-309.mp4,"https://indico.fnal.gov/event/19348/contributions/186573/attachments/129731/157511/LIV-NEUTRINO-2020-ID-309.mp4,https://indico.fnal.gov/event/19348/contributions/186573/attachments/129731/157511/LIV-NEUTRINO-2020-ID-309.mp4,https://indico.fnal.gov/event/19348/contributions/186573/attachments/129731/157506/LIV-Neutrino-2020.pdf",null,null,null,https://indico.fnal.gov/event/19348/contributions/186573/contribution.pdf,4
310,SuperNEMO double-beta decay detector progress,Cheryl Patrick,Cheryl Patrick,,The SuperNEMO Collaboration,SuperNEMO’s tracker-calorimeter will investigate double-beta decay mechanisms of Se-82 from 2021.,https://indico.fnal.gov/event/19348/contributions/186287/attachments/129742/157529/NeutrinoSuperNEMO2020PosterCPatrick.pdf,NotFound,https://indico.fnal.gov/event/19348/contributions/186287/attachments/129742/157529/NeutrinoSuperNEMO2020PosterCPatrick.pdf,null,null,null,https://indico.fnal.gov/event/19348/contributions/186287/contribution.pdf,1
311,Neutron Background Simulations for LEGEND-1000 in a Geant4-based Framework,CJ Barton,CJ Barton,,The LEGEND Collaboration,Simulations for LEGEND help optimize the final design of LEGEND-1000.,https://indico.fnal.gov/event/19348/contributions/186202/attachments/129580/157242/CJBarton-Neutrino2020-rev3.pdf,NotFound,https://indico.fnal.gov/event/19348/contributions/186202/attachments/129580/157242/CJBarton-Neutrino2020-rev3.pdf,null,null,null,https://indico.fnal.gov/event/19348/contributions/186202/contribution.pdf,2
312,CNO Solar Neutrino Flux Sensitivity with Theia,Max Smiley,Max Smiley,"Gabriel Orebi Gann,Richard Bonventre",Theia Collaboration,"CNO solar neutrino flux sensitivity with Theia, a multi-kiloton advanced optical neutrino detector",https://indico.fnal.gov/event/19348/contributions/186190/attachments/129886/157808/TheiaSolarNeutrinoPoster.pdf,https://indico.fnal.gov/event/19348/contributions/186190/attachments/129886/157809/TheiaSolarNeutrinoVideo.mp4,"https://indico.fnal.gov/event/19348/contributions/186190/attachments/129886/157808/TheiaSolarNeutrinoPoster.pdf,https://indico.fnal.gov/event/19348/contributions/186190/attachments/129886/157809/TheiaSolarNeutrinoVideo.mp4",null,null,null,https://indico.fnal.gov/event/19348/contributions/186190/contribution.pdf,3
313,Production of DUNE anode plane assemblies,Sebastien Prince,Sebastien Prince,,DUNE,Production of DUNE ionization-electron sensing components will start in 2020.,https://indico.fnal.gov/event/19348/contributions/186176/attachments/129437/157015/APA_production_v3.pdf,NotFound,https://indico.fnal.gov/event/19348/contributions/186176/attachments/129437/157015/APA_production_v3.pdf,null,null,null,https://indico.fnal.gov/event/19348/contributions/186176/contribution.pdf,4
314,Design and Operation of a Charged Particle Beamline for the NOvA Test Beam Experiment,David Duenas Tonguino,"David Duenas Tonguino,Michael Wallbank","Alexandre Sousa,Andrew Sutton,Teresa Lackey",NOvA Collaboration,NOvA has deployed a new beamline to provide tagged charged particles for its Test Beam program.,https://indico.fnal.gov/event/19348/contributions/186184/attachments/129881/157796/Poster_Neutrino2020_Beamline_NOvATB.pdf,NotFound,https://indico.fnal.gov/event/19348/contributions/186184/attachments/129881/157796/Poster_Neutrino2020_Beamline_NOvATB.pdf,null,null,null,https://indico.fnal.gov/event/19348/contributions/186184/contribution.pdf,1
315,WATCHMAN Sensitivity to Remote Reactor Discovery,Tomi Akindele,Tomi Akindele,,WATCHMAN,We explore the sensitivity of the WATCHMAN detector to discover or exclude nuclear reactors.,https://indico.fnal.gov/event/19348/contributions/186168/attachments/129921/157862/Akindele_neutrino2020_poster.pdf,NotFound,https://indico.fnal.gov/event/19348/contributions/186168/attachments/129921/157862/Akindele_neutrino2020_poster.pdf,null,null,null,https://indico.fnal.gov/event/19348/contributions/186168/contribution.pdf,2
316,Comparison of the measured atmospheric muon flux with Monte Carlo simulations for the first KM3NeT/ARCA and KM3NeT/ORCA Detection Units,Piotr Kalaczynski,Piotr Kalaczynski,,KM3NeT,“KM3NeT detectors are growing and the muon flux they measure agrees with the simulations”,https://indico.fnal.gov/event/19348/contributions/186566/attachments/129387/157268/poster.pdf,https://indico.fnal.gov/event/19348/contributions/186566/attachments/129387/157277/PK_Neutrino2020_v3.mp4,"https://indico.fnal.gov/event/19348/contributions/186566/attachments/129387/157277/PK_Neutrino2020_v3.mp4,https://indico.fnal.gov/event/19348/contributions/186566/attachments/129387/157268/poster.pdf,https://indico.fnal.gov/event/19348/contributions/186566/attachments/129387/157269/poster_smaller.png",null,null,null,https://indico.fnal.gov/event/19348/contributions/186566/contribution.pdf,3
317,Shower Reconstruction in Liquid Argon Time Projection Chambers using Graphical Neural Networks,Francois Drielsma,Francois Drielsma,"Kazuhiro Terao,Pierre Cote de Soux,Qing Lin",,Graphical Neural Networks offer a promising novel approach to shower reconstruction in LArTPCs,https://indico.fnal.gov/event/19348/contributions/186219/attachments/129916/157857/nu2020_lartpc_gnn_shower_reco_drielsma.pdf,https://indico.fnal.gov/event/19348/contributions/186219/attachments/129916/157876/nu2020_lartpc_gnn_shower_reco_drielsma_video.mp4,"https://indico.fnal.gov/event/19348/contributions/186219/attachments/129916/157857/nu2020_lartpc_gnn_shower_reco_drielsma.pdf,https://indico.fnal.gov/event/19348/contributions/186219/attachments/129916/157876/nu2020_lartpc_gnn_shower_reco_drielsma_video.mp4",null,null,null,https://indico.fnal.gov/event/19348/contributions/186219/contribution.pdf,4
318,SNOLAB Material Assay Capabilities,Tom Sonley,Tom Sonley,,SNOLAB,The SNOLAB material assay system measures intrinsic radioactivity of samples for design purposes.,https://indico.fnal.gov/event/19348/contributions/186201/attachments/129807/157645/Sonley_Neutrino_2020.pdf,NotFound,https://indico.fnal.gov/event/19348/contributions/186201/attachments/129807/157645/Sonley_Neutrino_2020.pdf,null,null,null,https://indico.fnal.gov/event/19348/contributions/186201/contribution.pdf,1
319,Interaction Clustering in Liquid Argon Time Projection Chamber using Graph Neural Networks,Qing Lin,"Francois Drielsma,Kazuhiro Terao,Pierre Cote de Soux,Qing Lin",,,Graph neural network based novel approach for clustering neutrino interactions in LAr TPCs.,https://indico.fnal.gov/event/19348/contributions/186177/attachments/129878/157847/2020-06-11_Qing_Lin_-_Full_chain_and_Interaction_clustering_posternu2020.pdf,NotFound,https://indico.fnal.gov/event/19348/contributions/186177/attachments/129878/157847/2020-06-11_Qing_Lin_-_Full_chain_and_Interaction_clustering_posternu2020.pdf,null,null,null,https://indico.fnal.gov/event/19348/contributions/186177/contribution.pdf,2
320,Searching for neutrino decoherence from quantum gravitational space-time fluctuations with IceCube.,Tom Stuttard,Tom Stuttard,,IceCube,Neutrino decoherence from quantum gravity with IceCube.,https://indico.fnal.gov/event/19348/contributions/186230/attachments/129502/157115/Poster_NeutrinoDecoherenceIceCube_TomStuttard_Neutrino2020.pdf,NotFound,https://indico.fnal.gov/event/19348/contributions/186230/attachments/129502/157115/Poster_NeutrinoDecoherenceIceCube_TomStuttard_Neutrino2020.pdf,null,null,null,https://indico.fnal.gov/event/19348/contributions/186230/contribution.pdf,3
321,Particle Clustering in LArTPCs with Embedding Learning Convolutional Neural Networks,Dae heun Koh,Dae heun Koh,Kazuhiro Terao,"DUNE, SBN",Fast and scalable deep neural networks for LArTPC particle clustering.,https://indico.fnal.gov/event/19348/contributions/186225/attachments/129856/157750/2020-06-15_Dae_Heun_Nu2020_Poster1.pdf,https://indico.fnal.gov/event/19348/contributions/186225/attachments/129856/157751/Nu2020_Poster_Video_Dae_Heun_Koh.mp4,"https://indico.fnal.gov/event/19348/contributions/186225/attachments/129856/157750/2020-06-15_Dae_Heun_Nu2020_Poster1.pdf,https://indico.fnal.gov/event/19348/contributions/186225/attachments/129856/157751/Nu2020_Poster_Video_Dae_Heun_Koh.mp4",null,null,null,https://indico.fnal.gov/event/19348/contributions/186225/contribution.pdf,4
322,Experiment Design Progress for a Neutrino Mass Measurement in the R&amp;D Phase of Project 8,Arina Telles,Arina Telles,,Project 8,R&amp;D towards measuring neutrino mass in Project 8 using electrons spiraling through a magnetic field,https://indico.fnal.gov/event/19348/contributions/186179/attachments/129794/157622/ArinaTelles_Neutrino2020.pdf,https://indico.fnal.gov/event/19348/contributions/186179/attachments/129794/157623/ArinaTelles_Neutrino2020_poster.mp4,"https://indico.fnal.gov/event/19348/contributions/186179/attachments/129794/157622/ArinaTelles_Neutrino2020.pdf,https://indico.fnal.gov/event/19348/contributions/186179/attachments/129794/157623/ArinaTelles_Neutrino2020_poster.mp4",null,null,null,https://indico.fnal.gov/event/19348/contributions/186179/contribution.pdf,1
323,Initial Results from the NOvA Test Beam Program,Teresa Lackey,Teresa Lackey,,,A first look at data from NOvA Test Beam - a scaled-down NOvA detector in a charged beamline.,None,None,,null,null,null,https://indico.fnal.gov/event/19348/contributions/186198/contribution.pdf,2
324,Neutrino-Nucleus Interactions in Central Engine of Core-Collapse Supernovae,Shun Furusawa,Shun Furusawa,,,Numerical study of neutrino-nucleus interactions in central engine of core-collapse supernovae,https://indico.fnal.gov/event/19348/contributions/186195/attachments/129033/156398/poster_furusawa324.pdf,https://indico.fnal.gov/event/19348/contributions/186195/attachments/129033/156397/brief_presentation_furusawa324.mp4,"https://indico.fnal.gov/event/19348/contributions/186195/attachments/129033/156397/brief_presentation_furusawa324.mp4,https://indico.fnal.gov/event/19348/contributions/186195/attachments/129033/156398/poster_furusawa324.pdf",null,null,null,https://indico.fnal.gov/event/19348/contributions/186195/contribution.pdf,3
325,Muon neutrinos and antineutrinos disappearance analysis from T2K,Stephane Zsoldos,Stephane Zsoldos,,T2K Collaboration,T2K $\nu_\mu$ and $\bar\nu_\mu$ disappearance analysis using a 3- and 2-flavour oscillation model.,https://indico.fnal.gov/event/19348/contributions/186208/attachments/129837/157711/T2K_numu_Neutrino2020.pdf,NotFound,https://indico.fnal.gov/event/19348/contributions/186208/attachments/129837/157711/T2K_numu_Neutrino2020.pdf,null,null,null,https://indico.fnal.gov/event/19348/contributions/186208/contribution.pdf,4
326,Anti neutrino sensitivity at Theia,Stephane Zsoldos,Stephane Zsoldos,"Andrew Barna,Gabriel Orebi Gann,Morgan Askins,Stephen Dye,Zara Bagdasarian",Theia Collaboration,Anti neutrinos from geo- and reactor sources sensitivity at Theia,None,None,,null,null,null,https://indico.fnal.gov/event/19348/contributions/186608/contribution.pdf,1
327,Nonparametric Modeling of Large Liquid Neutrino Detectors,Benda Xu,Benda Xu,Wei Dou,,Optics of large liquid neutrino detectors are effectively modeled by nonparametric regression.,None,None,,null,null,null,https://indico.fnal.gov/event/19348/contributions/186204/contribution.pdf,2
328,Probing Beyond the Standard Model Physics with the Deep Underground Neutrino Experiment,Alexandre Sousa,Alexandre Sousa,Jaehoon Yu,DUNE,The DUNE project sets out to probe exciting New Physics with novel detector and beam technologies,https://indico.fnal.gov/event/19348/contributions/186172/attachments/129546/157186/Sousa_Neutrino2020_DUNE_BSMPhysics_poster.pdf,NotFound,https://indico.fnal.gov/event/19348/contributions/186172/attachments/129546/157186/Sousa_Neutrino2020_DUNE_BSMPhysics_poster.pdf,null,null,null,https://indico.fnal.gov/event/19348/contributions/186172/contribution.pdf,3
329,Modeling the collective motion of charge carriers in Ge semiconductor detectors,Tommaso Comellato,Tommaso Comellato,"Matteo Agostini,Stefan Schönert",LEGEND,Collective motion of carriers impacts signal profile in germanium detectors,https://indico.fnal.gov/event/19348/contributions/186224/attachments/129671/157404/Poster_Neutrino2020_Comellato_v2.1.pdf,NotFound,https://indico.fnal.gov/event/19348/contributions/186224/attachments/129671/157404/Poster_Neutrino2020_Comellato_v2.1.pdf,null,null,null,https://indico.fnal.gov/event/19348/contributions/186224/contribution.pdf,4
330,A deep neural network to direct the Pandora multi-algorithm LArTPC event reconstruction,Andrew Chappell,Andrew Chappell,,DUNE,A hybrid method using deep learning and algorithmic approaches to pattern recognition in DUNE,https://indico.fnal.gov/event/19348/contributions/186187/attachments/129247/156727/acha_neutrino2020.pdf,NotFound,https://indico.fnal.gov/event/19348/contributions/186187/attachments/129247/156727/acha_neutrino2020.pdf,null,null,null,https://indico.fnal.gov/event/19348/contributions/186187/contribution.pdf,1
331,ANTARES search for a stacking of point sources of neutrinos with 11 years of data.,Julien Aublin,Julien Aublin,,ANTARES,ANTARES point sources search: hint of association with blazar MG3 J225517+2409 and IceCube HE track,https://indico.fnal.gov/event/19348/contributions/186523/attachments/129720/157491/PosterPS_StackNu2020_v2.pdf,NotFound,https://indico.fnal.gov/event/19348/contributions/186523/attachments/129720/157491/PosterPS_StackNu2020_v2.pdf,null,null,null,https://indico.fnal.gov/event/19348/contributions/186523/contribution.pdf,2
332,Measurement of beam related gamma background&nbsp;using plastic scintillator&nbsp;at&nbsp;JSNS$^{2}$,Daeun Jung,Daeun Jung,,JSNS$^{2}$,Results of shielding effect for beam related gamma background,https://indico.fnal.gov/event/19348/contributions/186551/attachments/129567/157219/posterJSNS2_Neutrino2020_floorgamma_20200614.pdf,NotFound,https://indico.fnal.gov/event/19348/contributions/186551/attachments/129567/157219/posterJSNS2_Neutrino2020_floorgamma_20200614.pdf,null,null,null,https://indico.fnal.gov/event/19348/contributions/186551/contribution.pdf,3
333,Complete predictions for high-energy neutrino propagation in matter,Alfonso Andres Garcia Soto,Alfonso Andres Garcia Soto,"Aart Heijboer,Juan Rojo,Rhorry Gauld",,State-of-the-art calculations for high-energy neutrino propagation in matter.,https://indico.fnal.gov/event/19348/contributions/186200/attachments/129578/157239/neutrino2020_poster.pdf,NotFound,"https://indico.fnal.gov/event/19348/contributions/186200/attachments/129578/157239/neutrino2020_poster.pdf,https://indico.fnal.gov/event/19348/contributions/186200/attachments/129578/157241/neutrino2020_video.m4v",null,null,null,https://indico.fnal.gov/event/19348/contributions/186200/contribution.pdf,4
335,Reconstruction with slow liquid scintillator,Wentai Luo,Wentai Luo,,,The good directional reconstruction by using the slow liquid scintillator,None,None,,null,null,null,https://indico.fnal.gov/event/19348/contributions/186182/contribution.pdf,1
336,Measuring the Fluorescence Time Profile of the JUNO Liquid Scintillator using Gamma Radiation and a Pulsed Neutron Beam,Matthias Raphael Stock,"Hans Steiger,Matthias Raphael Stock","Andreas Steiger,David Dörflinger,Lothar Oberauer,Ludwig Wallner,Ulrike Fahrendholz",JUNO Collaboration,Results for the fluorescence decay-time profiles of the JUNO liquid scintillator are presented.,https://indico.fnal.gov/event/19348/contributions/186384/attachments/129783/157604/TUMPosterNeutrino2020.pdf,NotFound,https://indico.fnal.gov/event/19348/contributions/186384/attachments/129783/157604/TUMPosterNeutrino2020.pdf,null,null,null,https://indico.fnal.gov/event/19348/contributions/186384/contribution.pdf,2
337,Tri-Partite entanglement in Neutrino Oscillations,Abhishek Kumar Jha,Abhishek Kumar Jha,"Bindu A. Bambah,Supratik Mukherjee",My Guide has collaboration with Fermilab,Three flavor neutrino oscillations exhibits the property of the class of W-state in quantum optics.,https://indico.fnal.gov/event/19348/contributions/186552/attachments/129490/157200/Abhishek__Neutrino_2020__Poster.pdf,https://indico.fnal.gov/event/19348/contributions/186552/attachments/129490/157201/Abhishek_Neutrino__2020__video.mp4,"https://indico.fnal.gov/event/19348/contributions/186552/attachments/129490/157200/Abhishek__Neutrino_2020__Poster.pdf,https://indico.fnal.gov/event/19348/contributions/186552/attachments/129490/157201/Abhishek_Neutrino__2020__video.mp4",null,null,null,https://indico.fnal.gov/event/19348/contributions/186552/contribution.pdf,3
338,Stacking search for muon neutrinos from Gamma-Ray Bursts with ANTARES neutrino telescope using 2007 to 2017 data,Angela Zegarelli,Angela Zegarelli,Silvia Celli,ANTARES Collaboration,GRB stacking search with 10 years of ANTARES data.,https://indico.fnal.gov/event/19348/contributions/186368/attachments/129447/157032/poster_neutrino2020_final_revised_version_Zegarelli.pdf,https://indico.fnal.gov/event/19348/contributions/186368/attachments/129447/157033/video_Zegarelli_posterGRBanalysis.mov,"https://indico.fnal.gov/event/19348/contributions/186368/attachments/129447/157032/poster_neutrino2020_final_revised_version_Zegarelli.pdf,https://indico.fnal.gov/event/19348/contributions/186368/attachments/129447/157033/video_Zegarelli_posterGRBanalysis.mov",null,null,null,https://indico.fnal.gov/event/19348/contributions/186368/contribution.pdf,4
339,Rapid response to extraordinary events with the IceCube experiment,Manuela Mallamaci,"Elisa Bernardini,Erik Blaufuss,Konstancja Satalecka,Manuela Mallamaci,Thomas Kintscher",,IceCube Collaboration,Summary of a real-time selection+analysis platform for transient neutrino sources in IceCube.,https://indico.fnal.gov/event/19348/contributions/186220/attachments/129603/157281/poster_neutrino2020.pdf,NotFound,https://indico.fnal.gov/event/19348/contributions/186220/attachments/129603/157281/poster_neutrino2020.pdf,null,null,null,https://indico.fnal.gov/event/19348/contributions/186220/contribution.pdf,1
340,Realtime Multi-Messenger Program of KM3NeT,Feifei Huang,Feifei Huang,"Damien Dornic,Massimiliano Lincetto",KM3NeT,The current status of KM3NeT's real-time multi-messenger program.,https://indico.fnal.gov/event/19348/contributions/186173/attachments/129659/157380/FHuang_KM3NeT_Realtime_Framework_Poster_Neutrino_2020_final.pdf,https://indico.fnal.gov/event/19348/contributions/186173/attachments/129659/157384/FHuang_KM3NeT_Online.mp4,"https://indico.fnal.gov/event/19348/contributions/186173/attachments/129659/157384/FHuang_KM3NeT_Online.mp4,https://indico.fnal.gov/event/19348/contributions/186173/attachments/129659/157380/FHuang_KM3NeT_Realtime_Framework_Poster_Neutrino_2020_final.pdf,https://indico.fnal.gov/event/19348/contributions/186173/attachments/129659/157531/go",null,null,null,https://indico.fnal.gov/event/19348/contributions/186173/contribution.pdf,2
341,The calibration system of the LEGEND-200 experiment,Yannick Müller,Yannick Müller,,LEGEND,The LEGEND-200 calibration system deploys sources to calibrate the 76Ge detector energy response.,https://indico.fnal.gov/event/19348/contributions/186189/attachments/129317/156825/poster_landscape_sims_LEGEND_neutrino_20.pdf,NotFound,https://indico.fnal.gov/event/19348/contributions/186189/attachments/129317/156825/poster_landscape_sims_LEGEND_neutrino_20.pdf,null,null,null,https://indico.fnal.gov/event/19348/contributions/186189/contribution.pdf,3
342,Energy Calibration for the GERDA Experiment,Junting Huang,Junting Huang,Chloe Ransom,GERDA,Details of the energy calibration performed in GERDA.,https://indico.fnal.gov/event/19348/contributions/186215/attachments/129648/157357/gerda_calibration_neutrino_2020.pdf,NotFound,https://indico.fnal.gov/event/19348/contributions/186215/attachments/129648/157357/gerda_calibration_neutrino_2020.pdf,null,null,null,https://indico.fnal.gov/event/19348/contributions/186215/contribution.pdf,4
343,Neutrinos from blazar PKS 1502+106,Xavier Rodrigues,Xavier Rodrigues,"Anna Franckowiak,Shan Gao,Simone Garrappa,Vaidehi Paliya,Walter Winter",,Cosmic-ray interactions in blazar PKS 1502+106 may help explain recent IceCube neutrino observation.,https://indico.fnal.gov/event/19348/contributions/186516/attachments/129945/157921/rodrigues_neutrino2020.pdf,NotFound,https://indico.fnal.gov/event/19348/contributions/186516/attachments/129945/157921/rodrigues_neutrino2020.pdf,null,null,null,https://indico.fnal.gov/event/19348/contributions/186516/contribution.pdf,1
344,Sterile Neutrino Dark Matter Model with $S_{4}$ Flavor Symmetry,Nayana Gautam,Nayana Gautam,Mrinal Kumar Das,,The  model is successful as it is consistent with the cosmological range of dark matter parameters.,None,None,,null,null,null,https://indico.fnal.gov/event/19348/contributions/186231/contribution.pdf,2
345,Study of muon-induced background in MMC detector arrays for the ECHo experiment,Alexander Goeggelmann,Alexander Goeggelmann,Josef Jochum,ECHo experiment,"Muonic backgound source in the ECHo experiment neglible, according to pulse shape analysis.",https://indico.fnal.gov/event/19348/contributions/186214/attachments/129480/157081/Neutrino_2020_Goeggelmann_v3.pdf,NotFound,https://indico.fnal.gov/event/19348/contributions/186214/attachments/129480/157081/Neutrino_2020_Goeggelmann_v3.pdf,null,null,null,https://indico.fnal.gov/event/19348/contributions/186214/contribution.pdf,3
346,Neutrino charged pion production on water in extended phase space using Michel electron reconstruction in the T2K Near Detector,Sam Jenkins,Sam Jenkins,Xianguo Lu,T2K,"Updated charged current single pion cross-section analysis, using Michel electron reconstruction",https://indico.fnal.gov/event/19348/contributions/186312/attachments/129983/157977/NeutrinoPoster_ND280bkg_flattened_v4.pdf,NotFound,https://indico.fnal.gov/event/19348/contributions/186312/attachments/129983/157977/NeutrinoPoster_ND280bkg_flattened_v4.pdf,null,null,null,https://indico.fnal.gov/event/19348/contributions/186312/contribution.pdf,4
347,A high-energy neutrino coincident with a Tidal Disruption Event,Robert Stein,Robert Stein,,Zwicky Transient Facility (ZTF),ZTF identifies the tidal disruption event AT2019dsg as a likely high-energy neutrino source,https://indico.fnal.gov/event/19348/contributions/186425/attachments/129683/157429/neutrino_2020_347_stein.pdf,https://indico.fnal.gov/event/19348/contributions/186425/attachments/129683/157430/neutrino_2020_347_stein.mp4,"https://indico.fnal.gov/event/19348/contributions/186425/attachments/129683/157430/neutrino_2020_347_stein.mp4,https://indico.fnal.gov/event/19348/contributions/186425/attachments/129683/157429/neutrino_2020_347_stein.pdf",null,null,null,https://indico.fnal.gov/event/19348/contributions/186425/contribution.pdf,1
