id,title,presenters,primary_authors,co_authors,collaboration,mini_abstract,poster_link,video_link,all_links,abstract,track,category,abstract_url,poster_session
189,Data quality and stability of the Borexino detector,CHIARA GHIANO,CHIARA GHIANO,,BOREXINO,Strategies for data quality and stability of the Borexino detector,https://indico.fnal.gov/event/19348/contributions/186607/attachments/129718/157672/ghiano_poster_neutrino2020_data_quality_and_stability_v4.pdf,NotFound,https://indico.fnal.gov/event/19348/contributions/186607/attachments/129718/157672/ghiano_poster_neutrino2020_data_quality_and_stability_v4.pdf,null,null,null,https://indico.fnal.gov/event/19348/contributions/186607/contribution.pdf,2
190,Potential dark matter signals at neutrino telescopes,Marco Chianese,Marco Chianese,,,A second leptophilic decaying dark matter component is preferred at 68% C.L. by HESE neutrinos.,https://indico.fnal.gov/event/19348/contributions/186410/attachments/128929/157258/Poster_Neutrino20_190_Marco_Chianese.pdf,https://indico.fnal.gov/event/19348/contributions/186410/attachments/128929/157267/Video_Neutrino20_190_Marco_Chianese.mp4,"https://indico.fnal.gov/event/19348/contributions/186410/attachments/128929/157258/Poster_Neutrino20_190_Marco_Chianese.pdf,https://indico.fnal.gov/event/19348/contributions/186410/attachments/128929/157267/Video_Neutrino20_190_Marco_Chianese.mp4",null,null,null,https://indico.fnal.gov/event/19348/contributions/186410/contribution.pdf,3
191,Neutral Current Background Rejection for the Low-Energy Excess Analysis using Wire-Cell Reconstruction in MicrobooNE,Giacomo Scanavini,Giacomo Scanavini,,MicroBooNE,Rejecting neutral current events using Wire-Cell tool for the low energy excess search in MicroBooNE,https://indico.fnal.gov/event/19348/contributions/186414/attachments/130023/158069/giacomo_scanavini_neutrino_2020.pdf,https://indico.fnal.gov/event/19348/contributions/186414/attachments/130023/158078/giacomo_scanavini_neutrino_2020_video.mp4,"https://indico.fnal.gov/event/19348/contributions/186414/attachments/130023/158069/giacomo_scanavini_neutrino_2020.pdf,https://indico.fnal.gov/event/19348/contributions/186414/attachments/130023/158078/giacomo_scanavini_neutrino_2020_video.mp4",null,null,null,https://indico.fnal.gov/event/19348/contributions/186414/contribution.pdf,4
192,Lepton-Nucleus Cross Section Measurements for DUNE with the LDMX Detector,Nhan Tran,"Nhan Tran,Omar Moreno,Shirley Li",,,LDMX will measure electron-nucleus scattering relevant to long-baseline oscillation program,https://indico.fnal.gov/event/19348/contributions/186620/attachments/129935/157880/nu2020_poster.pdf,NotFound,https://indico.fnal.gov/event/19348/contributions/186620/attachments/129935/157880/nu2020_poster.pdf,null,null,null,https://indico.fnal.gov/event/19348/contributions/186620/contribution.pdf,1
193,Barium capture and identification through bi-color molecular sensors and Two-Photon Absorption microscopy,Pablo Herrero Gómez,"Borja Aparicio,Celia Rogero-Blanco,Fernando Cossio,Francesc Monrabal,Iván Rivilla De la Cruz,Juan José Gomez-Cadenas,Zoraida Freixa",,NEXT,A selective bicolor molecular indicator is being developed as a Barium Tagging device for a GXe TPC.,https://indico.fnal.gov/event/19348/contributions/186405/attachments/129757/157557/poster_nu2020_V4.pdf,https://indico.fnal.gov/event/19348/contributions/186405/attachments/129757/157558/Towards_a_sensor_for_barium_tagging_poster_193.mp4,"https://indico.fnal.gov/event/19348/contributions/186405/attachments/129757/157557/poster_nu2020_V4.pdf,https://indico.fnal.gov/event/19348/contributions/186405/attachments/129757/157560/go,https://indico.fnal.gov/event/19348/contributions/186405/attachments/129757/157558/Towards_a_sensor_for_barium_tagging_poster_193.mp4,https://indico.fnal.gov/event/19348/contributions/186405/attachments/129757/157559/Towards_a_sensor_for_barium_tagging_poster_193.srt",null,null,null,https://indico.fnal.gov/event/19348/contributions/186405/contribution.pdf,2
194,High Statistics CCQE Like Anti Neutrino nucleus cross-section measurements on CH Target With Neutrino Energy ~ 6 GeV,Amit Bashyal,Amit Bashyal,,MINERvA,This presentation will show the current state of analysis and discussion for final results.,https://indico.fnal.gov/event/19348/contributions/186378/attachments/129463/157058/Neutrino2020PosterTemplate_ver5.pdf,https://indico.fnal.gov/event/19348/contributions/186378/attachments/129463/157059/GMT20200607-190859_Bashyal--A_2560x1440.mp4,"https://indico.fnal.gov/event/19348/contributions/186378/attachments/129463/157059/GMT20200607-190859_Bashyal--A_2560x1440.mp4,https://indico.fnal.gov/event/19348/contributions/186378/attachments/129463/157058/Neutrino2020PosterTemplate_ver5.pdf",null,null,null,https://indico.fnal.gov/event/19348/contributions/186378/contribution.pdf,3
195,Neutrino-Dark Matter Connections in Gauge Theories,Alexis Plascencia,Alexis Plascencia,"Clara Murgui,Pavel Fileviez Perez",,Interplay between origin of neutrino masses and properties of dark matter in gauge SM extensions,https://indico.fnal.gov/event/19348/contributions/186383/attachments/129756/157554/Plascencia_Neutrino2020.pdf,https://indico.fnal.gov/event/19348/contributions/186383/attachments/129756/157555/poster_explanation.mp4,"https://indico.fnal.gov/event/19348/contributions/186383/attachments/129756/157554/Plascencia_Neutrino2020.pdf,https://indico.fnal.gov/event/19348/contributions/186383/attachments/129756/157555/poster_explanation.mp4",null,null,null,https://indico.fnal.gov/event/19348/contributions/186383/contribution.pdf,4
196,The impact of FTFP and QGSP models on neutrino flux at the On-Axis and Off-Axis NuMI neutrino detector locations by using G4NuMI simulation,Nilay Bostan,Nilay Bostan,"Amit Bashyal,Athula Wickremasinghe,Katsuya Yonehara,Leonidas Aliaga Soplin,Pavel Snopok,Yiding Yu",DUNE,Neutrino flux predictions at the location of experiment detectors with different hadronic models,https://indico.fnal.gov/event/19348/contributions/186316/attachments/129461/157512/nilay_poster_neutrino2020.pdf,https://indico.fnal.gov/event/19348/contributions/186316/attachments/129461/157513/nilay_nu2020_video_.mp4,"https://indico.fnal.gov/event/19348/contributions/186316/attachments/129461/157513/nilay_nu2020_video_.mp4,https://indico.fnal.gov/event/19348/contributions/186316/attachments/129461/157512/nilay_poster_neutrino2020.pdf",null,null,null,https://indico.fnal.gov/event/19348/contributions/186316/contribution.pdf,1
197,Cosmogenic neutrino fluxes under the effect of active-sterile secret interactions,Damiano Francesco Giuseppe Fiorillo,Damiano Francesco Giuseppe Fiorillo,,,Active-sterile secret interactions can change cosmogenic neutrino spectra,https://indico.fnal.gov/event/19348/contributions/186380/attachments/129094/156482/Poster_Fiorillo.pdf,NotFound,https://indico.fnal.gov/event/19348/contributions/186380/attachments/129094/156482/Poster_Fiorillo.pdf,null,null,null,https://indico.fnal.gov/event/19348/contributions/186380/contribution.pdf,2
198,Influence of magnetic field on beta-processes in neutrino-driven supernova explosion,Alexandra Dobrynina,Alexandra Dobrynina,Igor Ognev,,The magnetic-field effects on beta-processes in supernova matter can reach several percent,https://indico.fnal.gov/event/19348/contributions/186412/attachments/129248/156730/go,NotFound,"https://indico.fnal.gov/event/19348/contributions/186412/attachments/129248/156730/go,https://indico.fnal.gov/event/19348/contributions/186412/attachments/129248/156730/go,https://indico.fnal.gov/event/19348/contributions/186412/attachments/129248/156729/Dobrynina-Neutrino2020.pdf,https://indico.fnal.gov/event/19348/contributions/186412/attachments/129248/156728/go",null,null,null,https://indico.fnal.gov/event/19348/contributions/186412/contribution.pdf,3
199,ARIADNE – A Liquid Argon Time Projection Chamber (LArTPC) featuring an utra-fast optical readout,Barney Philippou,Barney Philippou,"Adam Roberts,Jared Vann,Kostas Mavrokoridis,Krish Majumdar",ARIADNE,"ARIADNE LArTPC detector summary, including detail and benefits of the optical readout technology.",https://indico.fnal.gov/event/19348/contributions/186444/attachments/129627/157322/Neutrino2020-Poster_Final.pdf,https://indico.fnal.gov/event/19348/contributions/186444/attachments/129627/157332/trimmedFinalZoomVideo.mp4,"https://indico.fnal.gov/event/19348/contributions/186444/attachments/129627/157322/Neutrino2020-Poster_Final.pdf,https://indico.fnal.gov/event/19348/contributions/186444/attachments/129627/157332/trimmedFinalZoomVideo.mp4",null,null,null,https://indico.fnal.gov/event/19348/contributions/186444/contribution.pdf,4
200,The Violation of Equivalence Principle and Four Neutrino Oscillations  for Long Baseline Neutrinos,MADHURIMA PANDEY,MADHURIMA PANDEY,"AMIT DUTTA BANIK,ASHADUL HALDER,DEBASISH MAJUMDAR",,Probing VEP in LBL neutrinos by gravity and matter induced 3 and 4-neutrino oscillation,None,None,,null,null,null,https://indico.fnal.gov/event/19348/contributions/186448/contribution.pdf,1
201,Ion monitoring within the KATRIN experiment,Ana Paula Vizcaya Hernández,"Ana Paula Vizcaya Hernández,Fabian Friedel,Magnus Schloesser",,The KATRIN Collaboration,The ion flow in the KATRIN experiment is monitored and found to be below the specified limit,https://indico.fnal.gov/event/19348/contributions/186599/attachments/129511/157641/PosterNeutrino2020_IonsKATRIN.pdf,https://indico.fnal.gov/event/19348/contributions/186599/attachments/129511/157129/IonKatrinNeutrino2020.mp4,"https://indico.fnal.gov/event/19348/contributions/186599/attachments/129511/157129/IonKatrinNeutrino2020.mp4,https://indico.fnal.gov/event/19348/contributions/186599/attachments/129511/157641/PosterNeutrino2020_IonsKATRIN.pdf",null,null,null,https://indico.fnal.gov/event/19348/contributions/186599/contribution.pdf,2
202,Event reconstruction and tau neutrino appearance using CNNs for KM3NeT/ORCA,Thomas Eberl,Thomas Eberl,Michael Moser,for the KM3NeT Collaboration,Application of CNNs to KM3NeT/ORCA improves sensitivity to tau neutrinos and detector resolutions.,https://indico.fnal.gov/event/19348/contributions/186703/attachments/129592/157261/Poster_Neutrino2020_KM3NeT-ORCA-CNNs.pdf,NotFound,https://indico.fnal.gov/event/19348/contributions/186703/attachments/129592/157261/Poster_Neutrino2020_KM3NeT-ORCA-CNNs.pdf,null,null,null,https://indico.fnal.gov/event/19348/contributions/186703/contribution.pdf,3
203,Measuring neutrino cross-section with IceCube at intermediate energies (~100 GeV to a few TeV),Sarah Nowicki,Sarah Nowicki,,IceCube Neutrino Observatory,"Measuring neutrino cross-section for new, intermediate energy range with IceCube",https://indico.fnal.gov/event/19348/contributions/186588/attachments/129779/157596/intermedxsec_neutrino2020_poster_snowicki_final.pdf,NotFound,https://indico.fnal.gov/event/19348/contributions/186588/attachments/129779/157596/intermedxsec_neutrino2020_poster_snowicki_final.pdf,null,null,null,https://indico.fnal.gov/event/19348/contributions/186588/contribution.pdf,4
204,Constraining Systematic Uncertainties for the Electron Neutrino Search at MicroBooNE,Marianette Wospakrik,Marianette Wospakrik,,MicroBooNE,Multiple neutrino selections constrain systematics for the Electron Neutrino Search at MicroBooNE,https://indico.fnal.gov/event/19348/contributions/186582/attachments/130013/158051/Neutrino2020Poster_MWospakrik.pdf,NotFound,"https://indico.fnal.gov/event/19348/contributions/186582/attachments/130013/158051/Neutrino2020Poster_MWospakrik.pdf,https://indico.fnal.gov/event/19348/contributions/186582/attachments/130013/158052/go",null,null,null,https://indico.fnal.gov/event/19348/contributions/186582/contribution.pdf,1
205,Relating quantum mechanics and kinetics of neutrino oscillations,Alexander Kartavtsev,Alexander Kartavtsev,,,Uncertainty and Pauli principles in kinetic approach to neutrino oscillations via initial conditions,NotFound,NotFound,"https://indico.fnal.gov/event/19348/contributions/186533/attachments/129225/156689/go,https://indico.fnal.gov/event/19348/contributions/186533/attachments/129225/156689/go,https://indico.fnal.gov/event/19348/contributions/186533/attachments/129225/156687/Kartavtsev-Neutrino2020.pdf,https://indico.fnal.gov/event/19348/contributions/186533/attachments/129225/156756/Relating_quantum_mechanics_and_kinetics_of_neutrino_oscillations.mp4",null,null,null,https://indico.fnal.gov/event/19348/contributions/186533/contribution.pdf,2
206,Atmospheric Neutrino Physics with JUNO,Giulio Settanta,Giulio Settanta,"Cristina Martellini,Paolo Montini,Stefano Maria Mari",JUNO,Reconstructing the atmospheric neutrino energy spectrum with JUNO.,https://indico.fnal.gov/event/19348/contributions/186558/attachments/129491/157245/NEUTRINO_2020_Poster_JUNO_Settanta.pdf,https://indico.fnal.gov/event/19348/contributions/186558/attachments/129491/157915/Neutrino_2020_video_Settanta.mp4,"https://indico.fnal.gov/event/19348/contributions/186558/attachments/129491/157245/NEUTRINO_2020_Poster_JUNO_Settanta.pdf,https://indico.fnal.gov/event/19348/contributions/186558/attachments/129491/157915/Neutrino_2020_video_Settanta.mp4",null,null,null,https://indico.fnal.gov/event/19348/contributions/186558/contribution.pdf,3
207,Supernova neutrino Physics with the JUNO detector,Cristina Martellini,Cristina Martellini,"Giulio Settanta,Paolo Montini,Stefano Maria Mari",JUNO Experiment,Probabilistic unfolding method using the JUNO detector to reconstruct Supernova energy spectra,https://indico.fnal.gov/event/19348/contributions/186586/attachments/129577/157235/Martellini_Poster_Neutrino2020.pdf,NotFound,https://indico.fnal.gov/event/19348/contributions/186586/attachments/129577/157235/Martellini_Poster_Neutrino2020.pdf,null,null,null,https://indico.fnal.gov/event/19348/contributions/186586/contribution.pdf,4
208,T2K's MaCh3 Oscillation Analysis,Kevin Wood,Kevin Wood,,T2K,T2K updates neutrino oscillation measurements,https://indico.fnal.gov/event/19348/contributions/186546/attachments/129684/157431/neutrino2020_T2K-MaCh3_kwood.pdf,https://indico.fnal.gov/event/19348/contributions/186546/attachments/129684/157432/Neutrino2020poster.mov,"https://indico.fnal.gov/event/19348/contributions/186546/attachments/129684/157432/Neutrino2020poster.mov,https://indico.fnal.gov/event/19348/contributions/186546/attachments/129684/157431/neutrino2020_T2K-MaCh3_kwood.pdf",null,null,null,https://indico.fnal.gov/event/19348/contributions/186546/contribution.pdf,1
209,Physics Motivation of TAO Experiment,Guofu Cao,Guofu Cao,,JUNO,TAO can precisely measure the reactor neutrino spectrum and has multiple physics motivations.,None,None,,null,null,null,https://indico.fnal.gov/event/19348/contributions/186545/contribution.pdf,2
210,Oscillation tomography of the Earth with solar neutrinos and future experiments,Pouya Bakhti,Pouya Bakhti,Alexei Y. Smirnov,,We've studied the potential of future neutrino observatories to distinguish between 3D earth models.,https://indico.fnal.gov/event/19348/contributions/186536/attachments/129075/156518/Earth_tomography_by_solar_neutrinos.pdf,https://indico.fnal.gov/event/19348/contributions/186536/attachments/129075/156775/InShot_20200611_185236595.mp4,"https://indico.fnal.gov/event/19348/contributions/186536/attachments/129075/156518/Earth_tomography_by_solar_neutrinos.pdf,https://indico.fnal.gov/event/19348/contributions/186536/attachments/129075/156775/InShot_20200611_185236595.mp4",null,null,null,https://indico.fnal.gov/event/19348/contributions/186536/contribution.pdf,3
211,Fitting strategies for the KATRIN neutrino mass analysis using KaFit,Stephanie Hickford,Stephanie Hickford,"Kathrin Valerius,Leonard Köllenberger,Wonqook Choi",KATRIN,Multi-fitting with KaFit software as an improved and flexible fit method for the KATRIN experiment.,https://indico.fnal.gov/event/19348/contributions/186435/attachments/129842/157724/neutrino-2020-poster.pdf,NotFound,https://indico.fnal.gov/event/19348/contributions/186435/attachments/129842/157724/neutrino-2020-poster.pdf,null,null,null,https://indico.fnal.gov/event/19348/contributions/186435/contribution.pdf,4
212,Extraction of Bi-210 via Po-210 for CNO neutrino detection with Borexino,Sindhujha Kumaran,Sindhujha Kumaran,"Alexandre Göttel,Davide Basilico,Xuefeng Ding",Borexino Collaboration,$^{210}$Po homogeneity in Borexino gives a $^{210}$Bi upper limit for CNO neutrino detection,https://indico.fnal.gov/event/19348/contributions/186459/attachments/129665/157970/Poster_Neutrino2020_Borexino_Kumaran_212.pdf,https://indico.fnal.gov/event/19348/contributions/186459/attachments/129665/157399/Video_Neutrino2020_Borexino_Kumaran_212.mp4,"https://indico.fnal.gov/event/19348/contributions/186459/attachments/129665/157970/Poster_Neutrino2020_Borexino_Kumaran_212.pdf,https://indico.fnal.gov/event/19348/contributions/186459/attachments/129665/157399/Video_Neutrino2020_Borexino_Kumaran_212.mp4",null,null,null,https://indico.fnal.gov/event/19348/contributions/186459/contribution.pdf,3
213,Search for Long-Lived Heavy Neutrinos at the LHC with a VBF Trigger,Joaquin Masias,"Joaquin Masias,Joel Jones-Pérez,Jose David Ruiz Alvarez",,,Heavy Neutrinos could be observed at the LHC via a VBF trigger with a multitrack search.,https://indico.fnal.gov/event/19348/contributions/186507/attachments/129495/157102/poster_nu2020_landscape.pdf,https://indico.fnal.gov/event/19348/contributions/186507/attachments/129495/157103/nu2020.mp4,"https://indico.fnal.gov/event/19348/contributions/186507/attachments/129495/157103/nu2020.mp4,https://indico.fnal.gov/event/19348/contributions/186507/attachments/129495/157102/poster_nu2020_landscape.pdf",null,null,null,https://indico.fnal.gov/event/19348/contributions/186507/contribution.pdf,2
214,Clustering Cosmic Muon and Neutrino Interactions in MicroBooNE using a Deep Convolutional Neural Network,Joshua Mills,Joshua Mills,,MicroBooNE,A deep CNN to locate and cluster cosmic muon and neutrino events in the MicroBooNE detector,https://indico.fnal.gov/event/19348/contributions/186468/attachments/130016/158059/Neutrino_Poster_2020_Draft.pdf,https://indico.fnal.gov/event/19348/contributions/186468/attachments/130016/158060/MillsPosterPresentation_2nd_Draft.mp4,"https://indico.fnal.gov/event/19348/contributions/186468/attachments/130016/158060/MillsPosterPresentation_2nd_Draft.mp4,https://indico.fnal.gov/event/19348/contributions/186468/attachments/130016/158059/Neutrino_Poster_2020_Draft.pdf",null,null,null,https://indico.fnal.gov/event/19348/contributions/186468/contribution.pdf,3
215,Forecast on lepton asymmetry from future CMB experiments,Alexander Bonilla Rivera,Alexander Bonilla Rivera,"Everton M. C. Abreu,Rafael C. Nunes",,Our results are an update concerning on the cosmological lepton asymmetry and the neutrino mass.,https://indico.fnal.gov/event/19348/contributions/186602/attachments/129530/157157/poster_de_models.pdf,https://indico.fnal.gov/event/19348/contributions/186602/attachments/129530/157174/Video_Nv_2020.mov,"https://indico.fnal.gov/event/19348/contributions/186602/attachments/129530/157157/poster_de_models.pdf,https://indico.fnal.gov/event/19348/contributions/186602/attachments/129530/157174/Video_Nv_2020.mov",null,null,null,https://indico.fnal.gov/event/19348/contributions/186602/contribution.pdf,4
216,Quenching Factor Measurements for Germanium Detectors at Triangle Universities Nuclear Laboratory (TUNL),Long Li,Long Li,Belkis Cabrera-Palmer,COHERENT collaboration,The quenching factor of germanium detectors at low energy is precisely mea- sured.,https://indico.fnal.gov/event/19348/contributions/186491/attachments/129467/157064/geqfnv20land.pdf,NotFound,https://indico.fnal.gov/event/19348/contributions/186491/attachments/129467/157064/geqfnv20land.pdf,null,null,null,https://indico.fnal.gov/event/19348/contributions/186491/contribution.pdf,1
217,Pion Production Measurements with Advanced Decay Electron Reconstruction at MINERvA,Mehreen Sultana,Mehreen Sultana,,MINERvA Experiment,Exploration of new pion phase space using decay electron reconstruction in MINERvA.,https://indico.fnal.gov/event/19348/contributions/186465/attachments/129809/157677/M.Sultana_Neutrino2020_poster.pdf,NotFound,https://indico.fnal.gov/event/19348/contributions/186465/attachments/129809/157677/M.Sultana_Neutrino2020_poster.pdf,null,null,null,https://indico.fnal.gov/event/19348/contributions/186465/contribution.pdf,2
218,Study of Muon Monitor Data To Maintain The Quality Of The NuMI Neutrino Beam at Fermilab,Don Wickremasinghe,Don Wickremasinghe,Katsuya Yonehara,,We study the response of muon monitors with the primary beam parameters to address the beam quality.,https://indico.fnal.gov/event/19348/contributions/186494/attachments/129540/157172/Athula_Nu2020.pdf,NotFound,https://indico.fnal.gov/event/19348/contributions/186494/attachments/129540/157172/Athula_Nu2020.pdf,null,null,null,https://indico.fnal.gov/event/19348/contributions/186494/contribution.pdf,3
219,"Planning, Design, Construction, and Testing an Experimental System to characterize Photomultiplier Type EMI 9954B Using Cosmic Rays",Carlos Cervantes,Carlos Cervantes,"Julián Felix,luis Arceo",,"The Experimental system was planned, designed and constructed to evaluated and characterize PMT EMI",None,None,,null,null,null,https://indico.fnal.gov/event/19348/contributions/186496/contribution.pdf,4
221,Reactor Neutrinos in Super-Kamiokande,Alexander Goldsack,Alexander Goldsack,,Super-Kamiokande,The status of the reactor neutrino search in Super-Kamiokande using neutron tagging on hydrogen.,https://indico.fnal.gov/event/19348/contributions/186493/attachments/129573/157228/goldsack_neutrino2020_poster_final.pdf,https://indico.fnal.gov/event/19348/contributions/186493/attachments/129573/157227/goldsack_neutrino2020_vid_final.mp4,"https://indico.fnal.gov/event/19348/contributions/186493/attachments/129573/157228/goldsack_neutrino2020_poster_final.pdf,https://indico.fnal.gov/event/19348/contributions/186493/attachments/129573/157227/goldsack_neutrino2020_vid_final.mp4",null,null,null,https://indico.fnal.gov/event/19348/contributions/186493/contribution.pdf,1
222,Improvement of Energy Resolution in KamLAND-Zen by Implementing Signal Amplifier for Low-gain PMTs,Nanami Kawada,Nanami Kawada,,KamLAND-Zen,Signal amplifiers can improve the performance of low-gain PMTs and the detector energy resolution.,https://indico.fnal.gov/event/19348/contributions/186503/attachments/129593/157262/Signal_Amplifier_NEUTRINO_2020_Landscape.pdf,NotFound,https://indico.fnal.gov/event/19348/contributions/186503/attachments/129593/157262/Signal_Amplifier_NEUTRINO_2020_Landscape.pdf,null,null,null,https://indico.fnal.gov/event/19348/contributions/186503/contribution.pdf,2
223,Could the Hubble Tension be Pointing Toward the Neutrino Mass Mechanism?,Miguel Escudero,"Miguel Escudero,Sam Witte",,,A CMB search for the Neutrino Mass Mechanism and its Relation to the Hubble Tension,https://indico.fnal.gov/event/19348/contributions/186521/attachments/129721/157493/Escudero_223_Poster_Majoron_Neutrino2020.pdf,https://indico.fnal.gov/event/19348/contributions/186521/attachments/129721/157551/Escudero_223_Video_Majoron_Neutrino2020.mp4,"https://indico.fnal.gov/event/19348/contributions/186521/attachments/129721/157493/Escudero_223_Poster_Majoron_Neutrino2020.pdf,https://indico.fnal.gov/event/19348/contributions/186521/attachments/129721/157551/Escudero_223_Video_Majoron_Neutrino2020.mp4",null,null,null,https://indico.fnal.gov/event/19348/contributions/186521/contribution.pdf,3
224,LLAMA - A novel system for in-situ monitoring of optical parameters in liquid argon,Mario Schwarz,Mario Schwarz,"Laszlo Papp,Patrick Krause,Stefan Schönert",,LLAMA monitors the attenuation length and other optical key parameters of liquid argon in-situ,https://indico.fnal.gov/event/19348/contributions/186501/attachments/129641/157349/llama_poster_final.pdf,NotFound,https://indico.fnal.gov/event/19348/contributions/186501/attachments/129641/157349/llama_poster_final.pdf,null,null,null,https://indico.fnal.gov/event/19348/contributions/186501/contribution.pdf,4
225,Cosmogenic Background Rejection at the Short-Baseline Neutrino Program Far Detector Using the Cosmic Ray Tagging System,Christopher Hilgenberg,Christopher Hilgenberg,,ICARUS,Cosmic background suppression using combined Cosmic Ray Tagger and Photon Detection System in ICARUS,https://indico.fnal.gov/event/19348/contributions/186537/attachments/129959/157941/hilgenberg_neutrino2020_v2.pdf,NotFound,https://indico.fnal.gov/event/19348/contributions/186537/attachments/129959/157941/hilgenberg_neutrino2020_v2.pdf,null,null,null,https://indico.fnal.gov/event/19348/contributions/186537/contribution.pdf,1
226,Imaging of single Ba atoms and ions in solid xenon for barium tagging in nEXO,James Todd,James Todd,"David Fairbank,William Fairbank",nEXO,Results of single barium atom and ion imaging for nEXO,https://indico.fnal.gov/event/19348/contributions/186213/attachments/129825/157689/Todd_Neutrino2020_poster_final.pdf,https://indico.fnal.gov/event/19348/contributions/186213/attachments/129825/157690/Todd_Neutrino2020_poster_presentation.mp4,"https://indico.fnal.gov/event/19348/contributions/186213/attachments/129825/157689/Todd_Neutrino2020_poster_final.pdf,https://indico.fnal.gov/event/19348/contributions/186213/attachments/129825/157690/Todd_Neutrino2020_poster_presentation.mp4",null,null,null,https://indico.fnal.gov/event/19348/contributions/186213/contribution.pdf,2
227,Constraining the NuMI neutrino flux using neutrino + electron elastic scattering,Luis Zazueta,Luis Zazueta,,MINERvA,MINERvA constrains the NuMI flux prediction by measuring neutrino-electron elastic scattering,None,None,,null,null,null,https://indico.fnal.gov/event/19348/contributions/186486/contribution.pdf,3
