id,title,presenters,primary_authors,co_authors,collaboration,mini_abstract,poster_link,video_link,all_links,abstract,track,category,abstract_url,poster_session
428,Neutrino-Induced Neutron Detectors at the Spallation Neutron Source,Jacob Daughhetee,Jacob Daughhetee,,COHERENT,"Detectors search for neutrino-induced neutrons, a possible background for rare event searches.",https://indico.fnal.gov/event/19348/contributions/186625/attachments/129816/157663/Neutrion2020_NINsPoster_JD.pdf,NotFound,https://indico.fnal.gov/event/19348/contributions/186625/attachments/129816/157663/Neutrion2020_NINsPoster_JD.pdf,null,null,null,https://indico.fnal.gov/event/19348/contributions/186625/contribution.pdf,4
429,On the influence of a nonzero magnetic dipole moment of the neutrino for the trident processes in DUNE-ND.,Andrés Fernando Castillo Ramirez,Andrés Fernando Castillo Ramirez,Luz Gomez,Deep Underground Neutrino Experiment,We analyze the effects of neutrino magnetic moment to the lepton-pair production in DUNE-ND,https://indico.fnal.gov/event/19348/contributions/186420/attachments/129462/157056/NMMDUNENDV2.pdf,https://indico.fnal.gov/event/19348/contributions/186420/attachments/129462/157057/AndresNMMtridents.mp4,"https://indico.fnal.gov/event/19348/contributions/186420/attachments/129462/157057/AndresNMMtridents.mp4,https://indico.fnal.gov/event/19348/contributions/186420/attachments/129462/157056/NMMDUNENDV2.pdf",null,null,null,https://indico.fnal.gov/event/19348/contributions/186420/contribution.pdf,1
430,Segmentation Neural Networks for Particle Identification in ProtoDUNE,Carlos Sarasty,Carlos Sarasty,,DUNE,3D hit particle identification in ProtoDUNE using sparse neural networks,https://indico.fnal.gov/event/19348/contributions/186682/attachments/129972/157961/N2020CSarasty.pdf,NotFound,https://indico.fnal.gov/event/19348/contributions/186682/attachments/129972/157961/N2020CSarasty.pdf,null,null,null,https://indico.fnal.gov/event/19348/contributions/186682/contribution.pdf,2
431,Poisson Likelihood Covariance Technique for 3+1 Sterile Neutrino Searches in NOvA,Jeremy Hewes,Jeremy Hewes,,NOvA,Novel fit technique combining Poisson likelihood and Gaussian multivariate systematic uncertainties,https://indico.fnal.gov/event/19348/contributions/186662/attachments/129985/157980/2020-06-24_Likelihood_poster.pdf,NotFound,https://indico.fnal.gov/event/19348/contributions/186662/attachments/129985/157980/2020-06-24_Likelihood_poster.pdf,null,null,null,https://indico.fnal.gov/event/19348/contributions/186662/contribution.pdf,3
432,Calibrations in SNO+,Ryan Bayes,Ryan Bayes,,SNO+,"Methodology for the calibration of a low-background, deep underground, liquid scintillator detector.",https://indico.fnal.gov/event/19348/contributions/186678/attachments/129780/157598/Neutrino2020-Cal-Poster.pdf,https://indico.fnal.gov/event/19348/contributions/186678/attachments/129780/157599/SNO_Calibrations.mp4,"https://indico.fnal.gov/event/19348/contributions/186678/attachments/129780/157598/Neutrino2020-Cal-Poster.pdf,https://indico.fnal.gov/event/19348/contributions/186678/attachments/129780/157599/SNO_Calibrations.mp4",null,null,null,https://indico.fnal.gov/event/19348/contributions/186678/contribution.pdf,4
433,Detector Stability in NEOS-phase2,Young Ju Ko,Young Ju Ko,,NEOS Collaboration,The stability of the NEOS detector in phase2 and its effect on the analysis,https://indico.fnal.gov/event/19348/contributions/186388/attachments/129582/157244/Detector_Stability_NEOS_v13.pdf,NotFound,https://indico.fnal.gov/event/19348/contributions/186388/attachments/129582/157244/Detector_Stability_NEOS_v13.pdf,null,null,null,https://indico.fnal.gov/event/19348/contributions/186388/contribution.pdf,1
434,DMFlux: a tool for neutrino flux generation from dark matter annihilation and decay,Qinrui Liu,Qinrui Liu,"Ali Kheirandish,Carlos Arguelles,Francis Halzen,Jeffrey Lazar",,A neutrino flux Monte Carlo generator for dark matter annihilation and decay.,https://indico.fnal.gov/event/19348/contributions/186688/attachments/129907/157840/poster_qliu_DMFlux_neutrino2020.pdf,https://indico.fnal.gov/event/19348/contributions/186688/attachments/129907/157839/qliu_DMneutrino_video.mp4,"https://indico.fnal.gov/event/19348/contributions/186688/attachments/129907/157840/poster_qliu_DMFlux_neutrino2020.pdf,https://indico.fnal.gov/event/19348/contributions/186688/attachments/129907/157839/qliu_DMneutrino_video.mp4",null,null,null,https://indico.fnal.gov/event/19348/contributions/186688/contribution.pdf,2
435,Simulation study of Ocean Bottom Detector(OBD) for observation of geo-neutrinos from the mantle,Taichi Sakai,Taichi Sakai,"Eiichirou Araki,Hiroko Watanabe,Hiroshi Yoshida,Kenta Ueki,Kunio Inoue,Masanori Kyo,Natsue Abe,Noriaki Sakurai,Takafumi Kasaya,William McDonough",Ocean Bottom Detector,Detector design of Ocean Bottom Detector with MC simulation for mantle geo-neutrino measurement,https://indico.fnal.gov/event/19348/contributions/186689/attachments/129478/157259/neutrinoposter_OBD.pdf,https://indico.fnal.gov/event/19348/contributions/186689/attachments/129478/157079/neutrino_video.mp4,"https://indico.fnal.gov/event/19348/contributions/186689/attachments/129478/157259/neutrinoposter_OBD.pdf,https://indico.fnal.gov/event/19348/contributions/186689/attachments/129478/157079/neutrino_video.mp4",null,null,null,https://indico.fnal.gov/event/19348/contributions/186689/contribution.pdf,3
436,Light curves of BSM-induced neutrino echoes in the optically thin limit,Ali Kheirandish,Ali Kheirandish,"Kohta Murase,Ryan Eskenasy",,Light curves of beyond Standard Model induced neutrino echoes for astrophysical transients.,https://indico.fnal.gov/event/19348/contributions/186524/attachments/129918/157859/neutrino_echo_poster.pdf,NotFound,https://indico.fnal.gov/event/19348/contributions/186524/attachments/129918/157859/neutrino_echo_poster.pdf,null,null,null,https://indico.fnal.gov/event/19348/contributions/186524/contribution.pdf,4
437,"Tau neutrinos at DUNE: new strategies, new opportunities",Jessica Turner,Jessica Turner,Pedro Machado,,Analysis to detect tau neutrinos at DUNE using novel techniques.,https://indico.fnal.gov/event/19348/contributions/186669/attachments/129510/157128/Neutrino2020_437.pdf,https://indico.fnal.gov/event/19348/contributions/186669/attachments/129510/157136/1080p.mov,"https://indico.fnal.gov/event/19348/contributions/186669/attachments/129510/157136/1080p.mov,https://indico.fnal.gov/event/19348/contributions/186669/attachments/129510/157128/Neutrino2020_437.pdf",null,null,null,https://indico.fnal.gov/event/19348/contributions/186669/contribution.pdf,1
438,Strategy of detection of solar CNO neutrinos with Borexino Phase-III data,Xuefeng Ding,Xuefeng Ding,,BOREXINO,Prove CNO-cycle with CNO neutrinos in Borexino,https://indico.fnal.gov/event/19348/contributions/186721/attachments/129948/157902/Neutrino2020.pdf,NotFound,https://indico.fnal.gov/event/19348/contributions/186721/attachments/129948/157902/Neutrino2020.pdf,null,null,null,https://indico.fnal.gov/event/19348/contributions/186721/contribution.pdf,2
439,Ultralow background Kapton and Kapton-copper laminates,Isaac Arnquist,"Isaac Arnquist,Maria Laura di Vacri,Richard Saldanha",,,Clean Kapton: a gateway to low background flexible cables?,https://indico.fnal.gov/event/19348/contributions/186713/attachments/129458/157050/Poster_diVacri.pdf,https://indico.fnal.gov/event/19348/contributions/186713/attachments/129458/157051/Video_ULB_Kapton_and_Kapton-Cu_laminates-2.mp4,"https://indico.fnal.gov/event/19348/contributions/186713/attachments/129458/157050/Poster_diVacri.pdf,https://indico.fnal.gov/event/19348/contributions/186713/attachments/129458/157051/Video_ULB_Kapton_and_Kapton-Cu_laminates-2.mp4",null,null,null,https://indico.fnal.gov/event/19348/contributions/186713/contribution.pdf,3
440,Study of Numu-CC Pion Production in the Resonance Region Using Nomad Data,Hongyue Duyang,Hongyue Duyang,,NOMAD,Neutrino induced pion production in the resonance region studied with precision using NOMAD data.,https://indico.fnal.gov/event/19348/contributions/186331/attachments/129868/157777/poster.pdf,NotFound,https://indico.fnal.gov/event/19348/contributions/186331/attachments/129868/157777/poster.pdf,null,null,null,https://indico.fnal.gov/event/19348/contributions/186331/contribution.pdf,4
441,Three-loop neutrino masses via new massive gauge bosons from $E_6$ GUT,Sumit Ghosh,Sumit Ghosh,"Bhaskar Dutta,Ilia Gogoladze,Tianjun Li",,A testable TeV-scale three-loop neutrino mass model.,https://indico.fnal.gov/event/19348/contributions/186255/attachments/129895/157823/SG_Neutrino20.pdf,NotFound,https://indico.fnal.gov/event/19348/contributions/186255/attachments/129895/157823/SG_Neutrino20.pdf,null,null,null,https://indico.fnal.gov/event/19348/contributions/186255/contribution.pdf,1
442,Sterile Neutrino Search via Neutral-Current Disappearance with Antineutrinos in NOvA,Michael Wallbank,Michael Wallbank,,NOvA Collaboration,NOvA has set the first limits on sterile-driven NC-disappearance with long-baseline antineutrinos.,https://indico.fnal.gov/event/19348/contributions/186672/attachments/129811/157651/SterileNeutrinoSearchViaNeutralCurrentDisappearanceWithAntineutrinosInNOvA.pdf,NotFound,https://indico.fnal.gov/event/19348/contributions/186672/attachments/129811/157651/SterileNeutrinoSearchViaNeutralCurrentDisappearanceWithAntineutrinosInNOvA.pdf,null,null,null,https://indico.fnal.gov/event/19348/contributions/186672/contribution.pdf,2
443,Muon Neutrino Disappearance in the Short Baseline Neutrino Program,Gray Putnam,Gray Putnam,,Short Baseline Neutrino Program,Preliminary simulation-based muon neutrino event selection in the Short Baseline Neutrino Program,https://indico.fnal.gov/event/19348/contributions/186679/attachments/129754/157547/Gray_Putnam_Poster.pdf,https://indico.fnal.gov/event/19348/contributions/186679/attachments/129754/157618/Gray_Putnam_Presentation.mp4,"https://indico.fnal.gov/event/19348/contributions/186679/attachments/129754/157547/Gray_Putnam_Poster.pdf,https://indico.fnal.gov/event/19348/contributions/186679/attachments/129754/157618/Gray_Putnam_Presentation.mp4",null,null,null,https://indico.fnal.gov/event/19348/contributions/186679/contribution.pdf,3
444,Electronics Configurations and Signal Timing Analysis from LED Calibration in the JSNS2 experiment,Sanghoon Jeon,Sanghoon Jeon,,JSNS2,The JSNS2 experiment began data taking with LED runs in order to search sterile neutrino.,https://indico.fnal.gov/event/19348/contributions/186362/attachments/129584/157248/neutrino_2020.pdf,NotFound,https://indico.fnal.gov/event/19348/contributions/186362/attachments/129584/157248/neutrino_2020.pdf,null,null,null,https://indico.fnal.gov/event/19348/contributions/186362/contribution.pdf,4
445,A study of nuclear effects in a Straw Tube Tracker.,Jaydip Singh,"Jaydip Singh,Srishti Nagu","Jyotsna Singh,Roberto Petti,Sanjib Mishra",,Nuclear Effects in neutrino interactions with target materials considered in STT for DUNE-ND complex,None,None,,null,null,null,https://indico.fnal.gov/event/19348/contributions/186653/contribution.pdf,1
446,Development of Scintillating Bolometer with Large Undoped and Eu-doped CaF2 Crystals for Neutrinoless Double Beta Decay of 48Ca,Sei Yoshida,"Konosuke Tetsuno,Xiaolong Li","D.H. Kwon,H.J. Lee,H.L. Kim,Inwook Kim,Minkyu Lee,Saori Umehara,Sei Yoshida,Tadafumi Kishimoto,Yong-Hamb Kim",,Scintillating Bolometer with Large CaF2 Crystals for Neutrinoless Double Beta Decay of 48Ca,https://indico.fnal.gov/event/19348/contributions/186505/attachments/129904/157835/20200615Neutrino_Poster.pdf,NotFound,https://indico.fnal.gov/event/19348/contributions/186505/attachments/129904/157835/20200615Neutrino_Poster.pdf,null,null,null,https://indico.fnal.gov/event/19348/contributions/186505/contribution.pdf,2
447,Exploring New Physics at nuSTORM,Kaustav Chakraborty,"Kaustav Chakraborty,Kenneth Long,Srubabati Goswami",,,Exploring sterile neutrino &amp; non-unitarity at nuSTORM with CC and NC events using the MIND detector,https://indico.fnal.gov/event/19348/contributions/186648/attachments/129749/157539/neutrino2020-poster.pdf,NotFound,https://indico.fnal.gov/event/19348/contributions/186648/attachments/129749/157539/neutrino2020-poster.pdf,null,null,null,https://indico.fnal.gov/event/19348/contributions/186648/contribution.pdf,3
448,Implementation of an Optimal Trigger in CUPID-Mo to allow for Low Energy Searches,Bradford Welliver,Bradford Welliver,,CUPID-Mo,An Optimum Trigger can lower thresholds in CUPID-Mo allowing for low energy dark matter searches,https://indico.fnal.gov/event/19348/contributions/186627/attachments/129862/157763/bwelliver_neutrino2020.pdf,NotFound,https://indico.fnal.gov/event/19348/contributions/186627/attachments/129862/157763/bwelliver_neutrino2020.pdf,null,null,null,https://indico.fnal.gov/event/19348/contributions/186627/contribution.pdf,4
449,The Pandora reconstruction for Dual-Phase liquid argon TPCs,Maria Brigida Brunetti,Maria Brigida Brunetti,,DUNE,Adaptation of the Pandora Single-Phase LArTPC reconstruction to Dual-Phase LArTPCs,https://indico.fnal.gov/event/19348/contributions/186290/attachments/129958/157933/poster_Brunetti.pdf,https://indico.fnal.gov/event/19348/contributions/186290/attachments/129958/157934/Neutrino2020_449.mp4,"https://indico.fnal.gov/event/19348/contributions/186290/attachments/129958/157934/Neutrino2020_449.mp4,https://indico.fnal.gov/event/19348/contributions/186290/attachments/129958/157933/poster_Brunetti.pdf",null,null,null,https://indico.fnal.gov/event/19348/contributions/186290/contribution.pdf,1
450,Scintillation balloon for neutrino-less double-beta decay search with a liquid scintillator detector,Rikuo Nakamura,Rikuo Nakamura,"Haruo Ikeda,Koji Ishidoshiro,Sei Ieki,Syuhei Obara,Yoshihito Gando",KamLAND-Zen,Scintillation balloon can reduce the backgrounds of KamLAND2-Zen.,https://indico.fnal.gov/event/19348/contributions/186643/attachments/129623/157317/NEUTRINO2020_poster450.pdf,https://indico.fnal.gov/event/19348/contributions/186643/attachments/129623/157569/NEUTRINO2020_video450.mp4,"https://indico.fnal.gov/event/19348/contributions/186643/attachments/129623/157317/NEUTRINO2020_poster450.pdf,https://indico.fnal.gov/event/19348/contributions/186643/attachments/129623/157569/NEUTRINO2020_video450.mp4",null,null,null,https://indico.fnal.gov/event/19348/contributions/186643/contribution.pdf,2
451,Search for Heavy Neutral Leptons using the ArgoNeuT detector,Patrick Green,Patrick Green,,ArgoNeuT,Search for decays of heavy neutral leptons produced by the NuMI beam using the ArgoNeuT detector.,None,None,,null,null,null,https://indico.fnal.gov/event/19348/contributions/186611/contribution.pdf,3
452,Baryogenesis through leptogenesis in Inverse and Linear seesaw with A4  flavor symmetry,Maibam Ricky Devi,Maibam Ricky Devi,"Kalpana Bora,Nilavjyoti Hazarika",Not Applicable,"BAU through leptogenesis for Type II, Inverse, &amp; linear seesaw models using $A_{4}$ symmetry",https://indico.fnal.gov/event/19348/contributions/186615/attachments/129220/156679/Ricky_poster_9.6.2020.pdf,NotFound,https://indico.fnal.gov/event/19348/contributions/186615/attachments/129220/156679/Ricky_poster_9.6.2020.pdf,null,null,null,https://indico.fnal.gov/event/19348/contributions/186615/contribution.pdf,4
453,Lifting the core ­collapse supernova bounds on keV ­mass sterile neutrinos,Anna Malgorzata Suliga,Anna Malgorzata Suliga,"Irene Tamborra,Meng-Ru Wu",,New treatment of active-sterile neutrino mixing in supernovae challenges sterile neutrino bounds.,https://indico.fnal.gov/event/19348/contributions/186655/attachments/129518/157140/Suliga_Neutrino_2020_BLM.pdf,https://indico.fnal.gov/event/19348/contributions/186655/attachments/129518/157139/Suliga_Neutrino_2020_BLM.mp4,"https://indico.fnal.gov/event/19348/contributions/186655/attachments/129518/157139/Suliga_Neutrino_2020_BLM.mp4,https://indico.fnal.gov/event/19348/contributions/186655/attachments/129518/157140/Suliga_Neutrino_2020_BLM.pdf",null,null,null,https://indico.fnal.gov/event/19348/contributions/186655/contribution.pdf,1
454,Data Reduction Algorithms for the ECHo Experiment,Arnulf Barth,Arnulf Barth,,ECHo Collaboration,Advanced data reduction algorithms allow for a reliable identification of Ho-163 signals,https://indico.fnal.gov/event/19348/contributions/186456/attachments/129962/157944/ECHo_Data_Analysis_Final.pdf,NotFound,https://indico.fnal.gov/event/19348/contributions/186456/attachments/129962/157944/ECHo_Data_Analysis_Final.pdf,null,null,null,https://indico.fnal.gov/event/19348/contributions/186456/contribution.pdf,2
455,Sensitivity and event reconstruction with the Radio Neutrino Observatory Greenland (RNO-G),Christoph Welling,"Christoph Welling,Ilse Plaisier",,Radio Neutrino Observatory Greenland,Sensitivity and event reconstruction with the Radio Neutrino Observatory Greenland (RNO-G),https://indico.fnal.gov/event/19348/contributions/186621/attachments/129596/157271/NeutrinoPoster.pdf,https://indico.fnal.gov/event/19348/contributions/186621/attachments/129596/157272/video__Neutrino2020.mov,"https://indico.fnal.gov/event/19348/contributions/186621/attachments/129596/157271/NeutrinoPoster.pdf,https://indico.fnal.gov/event/19348/contributions/186621/attachments/129596/157272/video__Neutrino2020.mov",null,null,null,https://indico.fnal.gov/event/19348/contributions/186621/contribution.pdf,3
456,Systematics due to Energy Reconstruction and Multi-nucleon Effect and their impact on Oscillation Parameters Measurement.,Jaydip Singh,"Jaydip Singh,Paramita Deka","Kalpana Bora,Neelakshi Sarma",,Systematics due to Energy reconstruction and multinucleon effects for T2K and NOvA target materials.,https://indico.fnal.gov/event/19348/contributions/186642/attachments/129750/157542/Neutrino2020_JD.pdf,NotFound,https://indico.fnal.gov/event/19348/contributions/186642/attachments/129750/157542/Neutrino2020_JD.pdf,null,null,null,https://indico.fnal.gov/event/19348/contributions/186642/contribution.pdf,4
457,Calibration status of the SuperNEMO calorimeter,Cloé Girard-Carillo,Cloé Girard-Carillo,"Axel Pin,Hichem Tedjditi",,Calorimeter commissioning data confirms SuperNEMO double-beta detector meets performance goals.,https://indico.fnal.gov/event/19348/contributions/186175/attachments/129793/157620/Poster_Calo_2020_horiz.pdf,NotFound,https://indico.fnal.gov/event/19348/contributions/186175/attachments/129793/157620/Poster_Calo_2020_horiz.pdf,null,null,null,https://indico.fnal.gov/event/19348/contributions/186175/contribution.pdf,1
458,Searching for high-energy neutrinos from core-collapse supernovae,Jannis Necker,Jannis Necker,,IceCube,Results of a search for high-energy neutrinos from core-collapse supernovae with 7yr of IceCube data,https://indico.fnal.gov/event/19348/contributions/186646/attachments/129655/157376/IceCube_supernova_stacking_analysis_neutrino2020.pdf,https://indico.fnal.gov/event/19348/contributions/186646/attachments/129655/157407/neutrinoytstyle.mp4,"https://indico.fnal.gov/event/19348/contributions/186646/attachments/129655/157376/IceCube_supernova_stacking_analysis_neutrino2020.pdf,https://indico.fnal.gov/event/19348/contributions/186646/attachments/129655/157407/neutrinoytstyle.mp4",null,null,null,https://indico.fnal.gov/event/19348/contributions/186646/contribution.pdf,2
459,Probing New Neutrino Interactions with Double Beta Decay,Lukas Graf,Lukas Graf,,,Two-neutrino double beta decay sets interesting constraints on new neutrino (self-)interactions.,None,None,,null,null,null,https://indico.fnal.gov/event/19348/contributions/186266/contribution.pdf,3
460,Neutrino Flavor Conversions in Compact Astrophysical Objects,Ian Padilla-Gay,Ian Padilla-Gay,,,Neutrino advection may hinder the development of fast neutrino conversions in compact objects.,https://indico.fnal.gov/event/19348/contributions/186369/attachments/129457/157523/poster_neutrino2020.pdf,https://indico.fnal.gov/event/19348/contributions/186369/attachments/129457/157049/video_neutrino2020.mp4,"https://indico.fnal.gov/event/19348/contributions/186369/attachments/129457/157523/poster_neutrino2020.pdf,https://indico.fnal.gov/event/19348/contributions/186369/attachments/129457/157049/video_neutrino2020.mp4",null,null,null,https://indico.fnal.gov/event/19348/contributions/186369/contribution.pdf,4
461,Development of an Impurity Model for Large Liquid Xenon Detectors,Ako Jamil,Ako Jamil,"David Moore,Samuel Borden,Zepeng Li",nEXO,Modeling the Effect of  Electronegative Impurities on the Electron Lifetime in Liquid Xenon,https://indico.fnal.gov/event/19348/contributions/186462/attachments/129735/157516/Neutrino2020_ImpurityModel_Jamil.pdf,NotFound,https://indico.fnal.gov/event/19348/contributions/186462/attachments/129735/157516/Neutrino2020_ImpurityModel_Jamil.pdf,null,null,null,https://indico.fnal.gov/event/19348/contributions/186462/contribution.pdf,1
462,Modular Symmetry Approach to Neutrino Masses and Mixing,Pavel Novichkov,Pavel Novichkov,,,Viable modular-symmetric models predict the neutrino mass scale and the CP violation phases.,https://indico.fnal.gov/event/19348/contributions/186300/attachments/129612/157300/novichkov.pdf,NotFound,https://indico.fnal.gov/event/19348/contributions/186300/attachments/129612/157300/novichkov.pdf,null,null,null,https://indico.fnal.gov/event/19348/contributions/186300/contribution.pdf,2
463,GeV scale right-handed neutrinos and primordial gravitational wave,Hisashi Okui,Hisashi Okui,Takehiko Asaka,,Damping of primordial gravitational wave spectrum with long-lived GeV scale right-handed neutrinos,None,None,,null,null,null,https://indico.fnal.gov/event/19348/contributions/186285/contribution.pdf,3
464,Modeling of GERDA Phase II data,Katharina von Sturm,"Katharina von Sturm,Luigi Pertoldi","Ann-Kathrin Schütz,Thomas Wester",GERDA Collaboration,Background decomposition of single- and two-detector data in Gerda Phase II,https://indico.fnal.gov/event/19348/contributions/186251/attachments/129589/157285/ModelingOfGerdaPhaseIIData_Neutrino2020.pdf,https://indico.fnal.gov/event/19348/contributions/186251/attachments/129589/157284/ModelingOfGerdaPhaseIIData_Neutrino2020.mp4,"https://indico.fnal.gov/event/19348/contributions/186251/attachments/129589/157284/ModelingOfGerdaPhaseIIData_Neutrino2020.mp4,https://indico.fnal.gov/event/19348/contributions/186251/attachments/129589/157285/ModelingOfGerdaPhaseIIData_Neutrino2020.pdf",null,null,null,https://indico.fnal.gov/event/19348/contributions/186251/contribution.pdf,4
465,"The Delivery Status of JUNO 20"" PMTs and their Performance",Rong Zhao,Rong Zhao,,JUNO,"The Delivery Status of JUNO 20"" PMTs and their Performance",https://indico.fnal.gov/event/19348/contributions/186171/attachments/129479/157080/PMT_neutrino2020.pdf,NotFound,https://indico.fnal.gov/event/19348/contributions/186171/attachments/129479/157080/PMT_neutrino2020.pdf,null,null,null,https://indico.fnal.gov/event/19348/contributions/186171/contribution.pdf,1
466,Indirect search for dark matter in the Galactic Centre combining ANTARES and IceCube,Sara Rebecca Gozzini,"Nadège Iovine,Sara Rebecca Gozzini","Juan Antonio Aguilar Sanchez,Juan de Dios Zornoza Gomez,Sebastian Baur",ANTARES and IceCube,ANTARES and IceCube present combined limits on dark matter annihilation from the Galactic Centre.,https://indico.fnal.gov/event/19348/contributions/186720/attachments/129619/157312/ANTARES_CONF_2020_Poster_Neutrino2020_Gozzini_combinedDM_v3.pdf,NotFound,https://indico.fnal.gov/event/19348/contributions/186720/attachments/129619/157312/ANTARES_CONF_2020_Poster_Neutrino2020_Gozzini_combinedDM_v3.pdf,null,null,null,https://indico.fnal.gov/event/19348/contributions/186720/contribution.pdf,2
467,Search for heavy secluded dark matter with ANTARES,Sara Rebecca Gozzini,"Filippo Sala,Sara Rebecca Gozzini","Juan de Dios Zornoza Gomez,Miquel Ardid",ANTARES,ANTARES presents their limits on the annihilation of heavy secluded dark matter.,https://indico.fnal.gov/event/19348/contributions/186698/attachments/129620/157313/ANTARES_CONF_2020_Poster_Neutrino2020_Gozzini_secludedDM_v3.pdf,NotFound,https://indico.fnal.gov/event/19348/contributions/186698/attachments/129620/157313/ANTARES_CONF_2020_Poster_Neutrino2020_Gozzini_secludedDM_v3.pdf,null,null,null,https://indico.fnal.gov/event/19348/contributions/186698/contribution.pdf,3
468,The weak mixing angle in the DUNE near detector complex,Yuber F Perez-Gonzalez,Yuber F Perez-Gonzalez,"Andre de Gouvea,Pedro Machado,Zahra Tabrizi",,Rare neutrino scatterings will allow DUNE to constrain the weak mixing angle at precision of 2%,https://indico.fnal.gov/event/19348/contributions/186296/attachments/129669/157405/Poster_nu2020.pdf,https://indico.fnal.gov/event/19348/contributions/186296/attachments/129669/158001/YuberPerez_Neutrino2020.mp4,"https://indico.fnal.gov/event/19348/contributions/186296/attachments/129669/157405/Poster_nu2020.pdf,https://indico.fnal.gov/event/19348/contributions/186296/attachments/129669/158001/YuberPerez_Neutrino2020.mp4",null,null,null,https://indico.fnal.gov/event/19348/contributions/186296/contribution.pdf,4
